Main Category,Item Name,Item Name AR,Price,Description
Cold Drinks,Canned Iced Tea,ايس تي معلب,212,شاي منعش وبارد يقدم في علبة مريحة لرفع معنويات سريعة وباردة
Cold Drinks,Mojito,موهيتو,380,مزيج منعش من الليمون الطازج والنعناع وماء الصودا يقدم باردا فوق الثلج
Cold Drinks,Piña Colada,بينا كولادا,380,مزيج استوائي من جوز الهند الكريمي والأناناس الحلو يقدم باردا لتجربة هروب منعشة
Cold Drinks,Blue Ocean,بلو اوشن,292,مزيج نابض بالحياة واستوائي من الكوراكاو الأزرق والحمضيات المنعشة يقدم باردا لطعم نقي مستوحى من المحيط
Cold Drinks,Sunset,سانسیت,335,مشروب نابض ومنعش بطبقات يضم مزيجا من عصائر الفواكه الاستوائية لالتقاط ألوان غروب الشمس المثالي
Cold Drinks,Iced Coffee,ايس كوفي,290,قهوة باردة وناعمة تقدم فوق الثلج لإضافة دفعة منعشة
Cold Drinks,Iced Mocha,ايس موكا,290,مزيج بارد من الإسبريسو الغني والشوكولاتة الناعمة والحليب البارد يقدم فوق الثلج
Cold Drinks,Iced Caramel Latte,ایس كرميل لاتيه,310,إسبريسو بارد ممزوج بالحليب المخملي وشراب الكراميل الحلو يقدم فوق الثلج
Cold Drinks,Iced Chocolate,ايس شوكولا,330,حليب بارد وكريمي ممزوج بالشوكولاتة الغنية ليقدم متعة منعشة وجذابة
Cold Drinks,Iced Chocolate Coffee,ايس كوفي شوكليت,342,قهوة باردة ممزوجة بالشوكولاتة الغنية لزيادة الكافيين الناعمة والمنعشة
Cold Drinks,Iced Oreo Coffee,ايس كوفي أوريو,362,قهوة باردة منعشة ممزوجة بفتات الأوريو المقرمش ومزينة بنكهة كريمية لذيذة
Cold Drinks,Iced Blue Latte,ايس لاتيه بلو,330,لاتيه بارد منعش مع لمحة من الكوراساو الأزرق لإنهاء حمضي نابض بالحياة وكريمية وباردة
Cold Drinks,Fresh Ice tea,أيس تي فريش,360,شاي مثلج طبيعي
Hot Drink,Hot chocolate,هوت شوكليت,280,مزيج غني وكريمي من الكاكاو الفاخر والحليب المبخر يقدم دافئا لتقديم وجبة مريحة
Hot Drink,Jamaican Chocolate,جامايكان شوكليت,277,كاكاو ساخن على الطراز الكاريبي أصيل مصنوع من كرات الكاكاو النيئة المبشورة المطهوة على نار وادراج الطيب غني ترابي ومحلو تماما
Hot Drink,White chocolate,وايت شوكليت,280,شوكولاتة بيضاء ناعمة وكريمية مذابة في حليب بخار لتحصل على وجبة غنية ومخملية
Hot Drink,Hot Chocolate Cake,هوت شوكليت كيك,295,شوكولاتة ساخنة غنية ومخملية تعلوها كعكة شوكولاتة دافئة وفاخرة لتكون الحلوى الفاخرة الرائعة
Hot Drink,Nescafe Black,نسكافيه بلاك,185,قهوة سوداء كلاسيكية جريئة وقوية تقدم ساخنة لزيادة الكافيين النقية والمنشطة
Hot Drink,Nescafe black with milk,نسكافيه بلاك مع حليب,242,قهوة سوداء جريئة وعطرية مخففة بالحليب الكريمي لإنهاء ناعم ومتوازن
Hot Drink,Nescafe Dalgona,نسكافيه دلغونا,252,رغوة قهوة مخملية مخفوقة تقدم فوق الحليب البارد أو الدافئ لتقديم حلوى وهادئة
Hot Drink,3 in 1 Double,ثلاثة بواحد ظرفان,257,مزيج قهوة مريح وكريمي يقدم مع ظرفين لضعف النكهة
Hot Drink,Oriental coffee,قهوة شرقية,185,قهوة تقليدية غنية مطحونة بدقة مصنوعة من الهيل العطري لطعم جريء وأصيل
Hot Drink,Double oriental coffee,قهوة شرقية دبل,207,قهوة تقليدية جريئة وغنية تقدم كجرعة مزدوجة لنكهة عميقة وأصيلة
Hot Drink,3 in 1,ثلاثة بواحد,220,كيس مريح لحصة واحدة من القهوة الفورية الناعمة والكريمية
Hot Drink,Americano,أمريكانو,217,قهوة سوداء كلاسيكية وجريئة مصنوعة من الإسبريسو الغني والماء الساخن لنكهة ناعمة وعميقة
Hot Drink,2 in 1,إثنان بواحد,202,مزيج مريح وكلاسيكي من القهوة والكريمر يقدم ساخنا وجاهزا للاستمتاع
Hot Drink,2 in 1 with Nestlé,إثنان بواحد مع نستلة,222,مزيج ناعم من القهوة وحليب نستله المكثف الحلو لنهاية غنية وكريمية
Hot Drink,3 in 1 with Nestlé,ثلاثة بواحد مع نستلة,300,مزيج غني وكريمي من القهوة الفورية وحليب نستله يضاعف القوة ثلاث مرات ليقدم دفعة جريئة ومرضية
Hot Drink,3 in 1with Milk,ثلاثة بواحد مع حليب,242,مزيج ناعم وكريمي من القهوة الفورية والكريمة والسكر يقدم مع الحليب الدافئ
Hot Drink,2 in 1 with Milk,إثنان بواحد مع حليب,232,مزيج قهوة ناعم وكريمي ساخن يقدم مع الحليب الطازج لمشروب متوازن ومريح
Hot Drink,Espresso,اسبريسو,187,قهوة غنية ومركزة تحضر تحت الضغط لتحصل على نكهة جريئة ومكثفة
Hot Drink,Double espresso,اسبريسو دبل,207,جرعة مزدوجة غنية ومكثفة من الإسبريسو الفاخر برائحة جريئة وكريمة ناعمة
Hot Drink,Espresso with nestla,اسبريسو مع نسلة,212,إسبريسو جريء يلين بلمسة من الحليب المكثف الحلو والكريمي
Hot Drink,Macchiato,ماكياتو,202,إسبريسو جريء ملطخ بلمسة من رغوة الحليب المخملي المطهو على البخار
Hot Drink,Espresso mocha,اسبريسو موكا,222,مزيج غني من الإسبريسو الجريء والشوكولاتة المخملية مغطى بالحليب المطهو على البخار
Hot Drink,Espresso avocato,اسبريسو افوكاتو,232,مزيج فريد مستوحى من الإندونيسيا من الإسبريسو الغني والأفوكادو الكريمي محلى بالحليب المكثف ليقدم وجبة ناعمة وجذابة
Hot Drink,Café latte,كافيه لاتيه,242,إسبريسو ناعم متوازن مع حليب حريري مطهو على البخار وطبقة خفيفة من الرغوة
Hot Drink,Mocha latte,موكا لاتيه,252,مزيج غني من الإسبريسو والحليب المطهو على البخار مع لمسة شوكولاتة ناعمة
Hot Drink,Caramel latte,كرميل لاتيه,272,إسبريسو ناعم ممزوج بالحليب المخملي المطهو على البخار والكراميل الغني والزبدة
Hot Drink,Bounty latte,باونتي لاتيه,267,لاتيه غني وكريمي قائم على الإسبريسو مشبع بنكهة استوائية لجوز الهند والشوكولاتة الناعمة
Hot Drink,Cappuccino,كابوتشينو,277,إسبريسو غني مغطى بطبقة ناعمة من الحليب الكريمي الكثيف والرغوي
Hot Drink,Moccachino,موكاتشينو,280,مزيج غني ورغوي من الإسبريسو الجريء والحليب المطهو على البخار والشوكولاتة الحلوة مع طبقة مخملية من الرغوة
Hot Drink,Double Espresso with Nestlé,اسبريسو دبل مع نسلة,262,إسبريسو جريء مزدوج الشوت محلى بحليب نستله الكريمي المكثف
Hot Drink,Pistachio Latte,بيستاشو لاتيه,282,لاتيه إسبريسو ناعم وكريمي ممزوج بنكهة الفستق الفاخرة الغنية والمكسرات
Hot Drink,Seven Heaven Latte,سيفن هيفن لاتيه,282,لاتيه فاخر ممزوج بصلصات الكراميل والشوكولاتة المنزلية وينتهي بلمسة من شراب الفانيليا الحلو
Hot Drink,Spanish Latte,اسبانيش لاتيه,282,مشروب غني وكريمي قائم على الإسبريسو محلى بالحليب المكثف لإنهاء ناعم ومخملي
Hot Drink,Espresso Campana,اسبريسو كومبانا,212,جرعة إسبريسو غنية مغطاة بملعقة مخملية من الكريمة المخفوقة الطازجة
Hot Drink,Flavored tea,شاي منكه,185,مجموعة مهدئة من أوراق الشاي الفاخرة الممزوجة بنفحات فواكه وزهر متنوعة لتجربة عطرية وعطرية
Hot Drink,Hot herbs,اعشاب ساخنة,185,مجموعة مهدئة من الأعشاب الطبيعية العطرة المنقوعة لتجربة مهدئة ومنعشة
Hot Drink,Orchid Chocolate,سحلب شوكولا,285,مشروب أوركيد تقليدي دافئ وكريمي ممزوج بالشوكولاتة الغنية ليمنحه متعة مريحة
Hot Drink,Sahlab,سحلب,255,مشروب بودنغ حليب كريمي تقليدي من الشرق الأوسط بنكهة دقيق الأوركيد ومغطى بلمسة من القرفة
Hot Drink,Milo,میلو,250,مشروب شعير الشوكولاتة الكلاسيكي يقدم دافئا ليقدم متعة مريحة وتعزز الطاقة
Hot Drink,Milo Milk,میلو حليب,275,مشروب شعير شوكولاتة دافئ ومريح ممزوج بالحليب الكريمي المطهو على البخار
Breakfast,L'OR Breakfast,فطور لور,600,طبق صباحي غني وتقليدي يضم مجموعة متنوعة من النكهات الطازجة لبدء يومك
Manakeesh,Cheese,جبنة,420,خبز مسطح تقليدي مغطى بمزيج غني وذائب من الأجبان المالحة
Manakeesh,Kashkaval,قشقوان,455,خبز مسطح دافئ وهش مغطى بجبن كاشكافال الغني المذاب لنهاية ذهبية مالحة
Manakeesh,Zaatar,زعتر,365,خبز مسطح تقليدي مغطى بمزيج لذيذ من الزعتر المجفف وبذور السمسم المحمصة والسماق ممزوج بزيت الزيتون
Manakeesh,Labneh,لبنة,385,عجينة تقليدية مغطاة باللبنة الكريمية الحامضة ورشة من زيت الزيتون
Manakeesh,Peppers,فليفلة,365,خبز مسطح طازج مغطى بدهن فلفل رومي نابض بالحياة ومالح ومتبل قليلا
Manakeesh,Cheese & Peppers,جبنة وفليفلة,385,خبز دافئ تقليدي مسطح مغطى بمزيج مالح من الجبن المذاب والفلفل الحار
Manakeesh,Olives,زيتون,385,خبز مسطح طازج مع شرائح زيتون مالحة ومزيج من التوابل التقليدية
Manakeesh,Kurdish,كردية,415,خبز مسطح تقليدي من الشرق الأوسط مع مزيج من اللحم المفروم والخضروات المملح والمبلل
Manakeesh,Turkey & Kashkaval,حبش وقشقوان,465,عجينة ماناكيش دافئة تعلوها شرائح ديك رومي مالحة وجبن كاشكفال مذاب
Manakeesh,Kashkaval & Sausage,قشقوان وسجق,465,خبز دافئ مغطى بنقانق مالحة وجبن كاشكفال مذاب
Hookah,Hookah,أركيلة,210,خلطات التبغ المنكهة الفاخرة لتجربة تدخين ناعمة وعطرية
Hookah,Hooka Head,تبديل راس,130,فحم طازج ووعاء تبغ جديد لتجديد تجربة الشيشة الخاصة بك
Hookah,Hookah Hose,نربيج اركيلة,35,تحضير وإعداد الشيشة بشكل احترافي لتجربة تدخين سلسة ومثالية
Services,Pistachio Platter,صحن فستق,165,مجموعة من الفستق المحمص الفاخر المملح بشكل مثالي لوجبة خفيفة مقرمشة ومليئة بالنكهة
Services,Mixed Savory Platter,صحن موالح مشكلة,365,مجموعة من الوجبات الخفيفة المقرمشة والمالحة والمكسرات المختلطة مثالية للمشاركة
Services,Cucumber and Carrot Platter,صحن خيار وجزر,165,تشكيلة منعشة من أعواد الخيار والجزر المقرمشة والباردة تقدم طازجة
Services,Rice Platter,صحن رز,150,حصة من الأرز الأبيض المنفوش والمبهوى على البخار بشكل مثالي ليكمل أي طبق رئيسي
Services,Sautéed Vegetables,خضار سوتيه,110,خضروات موسمية طازجة مقلية برفق حتى تصبح مقرمشة وطرية
Services,Large Water,ماء كبيرة,110,زجاجة كبيرة ومنعشة من الماء المعدني المبرد
